{
  "$schema": "https://json-schema.org/draft/2020-12/schema",
  "$id": "https://companion.local/schema/mon-ingested-frame-pack-v1.json",
  "title": "MON_INGESTED_FRAME_PACK_V1",
  "type": "object",
  "additionalProperties": false,
  "required": ["profile", "schema_version", "source_profile", "source_pack_id", "pack_revision", "body_revision", "developmental_stage", "approval_state", "approved_references", "provenance", "timing", "request_profile", "source_assets", "tracks", "pack_digest"],
  "properties": {
    "profile": {"const": "MON_INGESTED_FRAME_PACK_V1"}, "schema_version": {"const": 1}, "pack_id": {"type": "string", "format": "uuid"}, "source_profile": {"enum": ["MON_AUTHORED_FRAME_SOURCE_PACK_V1", "MON_OPAQUE_BLACK_FRAME_SOURCE_PACK_V1"]}, "source_pack_id": {"type": "string", "format": "uuid"},
    "pack_revision": {"type": "string", "pattern": "^[a-z0-9][a-z0-9._-]{2,63}$"}, "body_revision": {"type": "string", "pattern": "^[a-z0-9][a-z0-9._-]{2,63}$"}, "developmental_stage": {"type": "string", "pattern": "^[a-z][a-z0-9_]{1,31}$"},
    "approval_state": {"enum": ["candidate", "operator_approved", "rejected", "synthetic_test_only"]}, "approved_references": {"$ref": "#/$defs/approved_references"}, "provenance": {"$ref": "#/$defs/pack_provenance"}, "timing": {"$ref": "#/$defs/timing_profile"}, "request_profile": {"enum": ["phase02_bounded_motion_proof_v1", "synthetic_r04_test_v1", "r06_operator_approved_black_visual_master_v1"]},
    "runtime_profile": {"type": "object", "additionalProperties": true}, "source_assets": {"type": "array", "minItems": 1, "items": {"$ref": "#/$defs/ingested_asset"}}, "tracks": {"type": "array", "minItems": 1, "items": {"$ref": "#/$defs/track"}}, "pack_digest": {"$ref": "#/$defs/sha256"}
  },
  "$defs": {
    "sha256": {"type": "string", "pattern": "^[0-9a-f]{64}$"}, "facing": {"enum": ["front", "front_right", "right", "back_right", "back", "back_left", "left", "front_left"]}, "posture": {"enum": ["neutral", "listening", "acknowledging", "walking"]},
    "point": {"type": "object", "additionalProperties": false, "required": ["x", "y"], "properties": {"x": {"type": "integer", "minimum": 0, "maximum": 1253}, "y": {"type": "integer", "minimum": 0, "maximum": 1253}}},
    "landmark": {"type": "object", "additionalProperties": false, "required": ["state", "point"], "properties": {"state": {"enum": ["visible", "occluded", "not_applicable"]}, "point": {"anyOf": [{"$ref": "#/$defs/point"}, {"type": "null"}]}}, "oneOf": [{"properties": {"state": {"const": "visible"}, "point": {"$ref": "#/$defs/point"}}}, {"properties": {"state": {"enum": ["occluded", "not_applicable"]}, "point": {"type": "null"}}}]},
    "landmarks": {"type": "object", "additionalProperties": false, "required": ["root", "ground_contact_left", "ground_contact_right", "head_center", "eye_midpoint", "eye_left", "eye_right", "mouth_center", "hand_left", "hand_right", "foot_left", "foot_right", "attachment_back", "attachment_front", "interaction_focus", "action_anchor", "object_anchor"], "properties": {"root": {"$ref": "#/$defs/landmark"}, "ground_contact_left": {"$ref": "#/$defs/landmark"}, "ground_contact_right": {"$ref": "#/$defs/landmark"}, "head_center": {"$ref": "#/$defs/landmark"}, "eye_midpoint": {"$ref": "#/$defs/landmark"}, "eye_left": {"$ref": "#/$defs/landmark"}, "eye_right": {"$ref": "#/$defs/landmark"}, "mouth_center": {"$ref": "#/$defs/landmark"}, "hand_left": {"$ref": "#/$defs/landmark"}, "hand_right": {"$ref": "#/$defs/landmark"}, "foot_left": {"$ref": "#/$defs/landmark"}, "foot_right": {"$ref": "#/$defs/landmark"}, "attachment_back": {"$ref": "#/$defs/landmark"}, "attachment_front": {"$ref": "#/$defs/landmark"}, "interaction_focus": {"$ref": "#/$defs/landmark"}, "action_anchor": {"$ref": "#/$defs/landmark"}, "object_anchor": {"$ref": "#/$defs/landmark"}}},
    "approved_references": {"type": "object", "additionalProperties": false, "required": ["identity_sha256", "turnaround_sha256"], "properties": {"identity_sha256": {"$ref": "#/$defs/sha256"}, "turnaround_sha256": {"$ref": "#/$defs/sha256"}}},
    "pack_provenance": {"type": "object", "additionalProperties": false, "required": ["art_authority", "generation_or_edit_method", "source_authority", "rights_record"], "properties": {"art_authority": {"type": "string", "minLength": 1}, "generation_or_edit_method": {"type": "string", "minLength": 1}, "source_authority": {"type": "string", "minLength": 1}, "rights_record": {"type": "string", "minLength": 1}}},
    "timing_profile": {"type": "object", "additionalProperties": false, "required": ["fps", "tick_unit"], "properties": {"fps": {"const": 24}, "tick_unit": {"const": "1/24_second"}}},
    "ingested_asset": {"type": "object", "additionalProperties": false, "required": ["asset_id", "source_sha256", "source_filename", "content_address", "runtime_asset", "validation"], "properties": {"asset_id": {"type": "string", "pattern": "^[a-z][a-z0-9._-]{2,95}$"}, "source_sha256": {"$ref": "#/$defs/sha256"}, "source_filename": {"type": "string", "pattern": "^frames/[a-z][a-z0-9._-]{2,127}\\.png$"}, "content_address": {"type": "string", "pattern": "^sources/sha256/(?:[0-9a-f]{2}/[0-9a-f]{64}\\.png|[0-9a-f]{64})$"}, "runtime_asset": {"type": "string", "pattern": "^runtime/frames/[a-z][a-z0-9._-]{2,127}\\.png$"}, "validation": {"type": "object", "additionalProperties": true}}},
    "frame": {"type": "object", "additionalProperties": false, "required": ["frame_id", "frame_index", "filename", "sidecar_filename", "duration_ticks", "source_asset_id", "source_sha256", "facing", "posture", "landmarks", "provenance"], "properties": {"frame_id": {"type": "string", "pattern": "^[a-z0-9][a-z0-9._-]{2,95}$"}, "frame_index": {"type": "integer", "minimum": 0, "maximum": 999}, "filename": {"type": "string", "pattern": "^(?:frames/)?[a-z][a-z0-9._-]{2,127}\\.png$"}, "sidecar_filename": {"type": "string", "pattern": "^(?:sidecars/)?[a-z][a-z0-9._-]{2,127}\\.frame\\.json$"}, "duration_ticks": {"type": "integer", "minimum": 1, "maximum": 240}, "source_asset_id": {"type": "string"}, "source_sha256": {"$ref": "#/$defs/sha256"}, "facing": {"$ref": "#/$defs/facing"}, "posture": {"$ref": "#/$defs/posture"}, "action_phase": {"type": ["string", "null"]}, "landmarks": {"$ref": "#/$defs/landmarks"}, "landmark_provenance": {"type": "object", "additionalProperties": false, "patternProperties": {"^[a-z][a-z0-9_]{1,63}$": {"type": "object", "additionalProperties": true}}, "minProperties": 1}, "provenance": {"type": "object", "additionalProperties": false, "required": ["authored_by", "method", "source_revision"], "properties": {"authored_by": {"type": "string"}, "method": {"type": "string"}, "source_revision": {"type": "string"}}}, "reuse_of": {"type": ["string", "null"]}}},
    "contact": {"type": "object", "additionalProperties": false, "required": ["landmark", "state", "start_tick", "end_tick"], "properties": {"landmark": {"enum": ["ground_contact_left", "ground_contact_right", "hand_left", "hand_right", "foot_left", "foot_right"]}, "state": {"enum": ["planted", "swing", "clear"]}, "start_tick": {"type": "integer", "minimum": 0}, "end_tick": {"type": "integer", "minimum": 1}}},
    "event": {"type": "object", "additionalProperties": false, "required": ["event_id", "name", "tick", "frame_index"], "properties": {"event_id": {"type": "string"}, "name": {"type": "string"}, "tick": {"type": "integer", "minimum": 0}, "frame_index": {"type": "integer", "minimum": 0}}},
    "interruption": {"type": "object", "additionalProperties": false, "required": ["start_tick", "end_tick"], "properties": {"start_tick": {"type": "integer", "minimum": 0}, "end_tick": {"type": "integer", "minimum": 1}}},
    "track": {"type": "object", "additionalProperties": false, "required": ["track_id", "family", "selection_facing", "entry_facing", "exit_facing", "posture", "variant", "entry_posture", "exit_posture", "completion", "frames", "contacts", "events", "interruption_ranges", "track_checksum"], "properties": {"track_id": {"type": "string"}, "family": {"type": "string"}, "selection_facing": {"$ref": "#/$defs/facing"}, "entry_facing": {"$ref": "#/$defs/facing"}, "exit_facing": {"$ref": "#/$defs/facing"}, "posture": {"$ref": "#/$defs/posture"}, "variant": {"type": "integer"}, "entry_posture": {"$ref": "#/$defs/posture"}, "exit_posture": {"$ref": "#/$defs/posture"}, "completion": {"enum": ["once", "loop"]}, "frames": {"type": "array", "minItems": 1, "items": {"$ref": "#/$defs/frame"}}, "contacts": {"type": "array", "items": {"$ref": "#/$defs/contact"}}, "events": {"type": "array", "items": {"$ref": "#/$defs/event"}}, "interruption_ranges": {"type": "array", "items": {"$ref": "#/$defs/interruption"}}, "track_checksum": {"$ref": "#/$defs/sha256"}}}
  }
}
